{
  "request_id": "QDPLAB-E6C79DE63F997436",
  "candidate_id": "m06-case-7",
  "branch_or_model_tag": "M06_CASE_CONFIRMED_READY",
  "lane": "recovery",
  "scheduler_state": "DRAFTED",
  "exact_falsifier": "Confirmed matched-fabrication sweeps must preserve the discriminant ordering.",
  "priority_experiments": [
    "Cross-device matched-fabrication sweep"
  ],
  "requested_output_artifacts": [
    "EXECUTABLE_FALSIFIER_PACKAGE"
  ],
  "candidate_target_devices": [
    "DEV_A",
    "DEV_B"
  ],
  "instrument_profile_ref": "G:\\GitHub\\incubate\\QDP\\artifacts\\lab\\requests\\m06-case-7\\QDPLAB-E6C79DE63F997436_instrument_profile.json",
  "candidate_artifact_manifest_ref": "G:\\GitHub\\incubate\\QDP\\artifacts\\lab\\requests\\m06-case-7\\QDPLAB-E6C79DE63F997436_candidate_manifest.json",
  "notes": [
    "Generated by qdp.py lab pack from surfaced candidate artifacts."
  ]
}