{
  "request_id": "QDPLAB-33EF62EA8E8567A9",
  "candidate_id": "m09-case-tls",
  "branch_or_model_tag": "M09_CASE_TLS",
  "lane": "recovery",
  "scheduler_state": "DRAFTED",
  "exact_falsifier": "If the TLS branch is real, readout-power and temperature sweeps must reproduce the saturation trend across matched geometry or participation changes.",
  "priority_experiments": [
    "TLS saturation sweep: readout power x temperature x geometry or participation"
  ],
  "requested_output_artifacts": [
    "EXECUTABLE_FALSIFIER_PACKAGE"
  ],
  "candidate_target_devices": [],
  "instrument_profile_ref": "G:\\GitHub\\incubate\\QDP\\artifacts\\lab\\requests\\m09-case-tls\\QDPLAB-33EF62EA8E8567A9_instrument_profile.json",
  "candidate_artifact_manifest_ref": "G:\\GitHub\\incubate\\QDP\\artifacts\\lab\\requests\\m09-case-tls\\QDPLAB-33EF62EA8E8567A9_candidate_manifest.json",
  "notes": [
    "Generated by qdp.py lab pack from surfaced candidate artifacts.",
    "Branch-specific sweep axes remain on the candidate via simulation_conditions and tested_parameter_ranges; use the candidate manifest path to recover them."
  ]
}