{
  "request_id": "QDPLAB-77FC92FFD3214625",
  "candidate_id": "m06-case-7",
  "branch_or_model_tag": "M06_CASE_CONFIRMED_READY",
  "lane": "recovery",
  "scheduler_state": "DRAFTED",
  "exact_falsifier": "Confirmed matched-fabrication sweeps must preserve the discriminant ordering.",
  "priority_experiments": [],
  "requested_output_artifacts": [],
  "candidate_target_devices": [],
  "instrument_profile_ref": "C:\\Users\\Forre\\Documents\\QDP\\artifacts\\lab\\requests\\m06-case-7\\QDPLAB-77FC92FFD3214625_instrument_profile.json",
  "candidate_artifact_manifest_ref": "C:\\Users\\Forre\\Documents\\QDP\\artifacts\\lab\\requests\\m06-case-7\\QDPLAB-77FC92FFD3214625_candidate_manifest.json",
  "notes": [
    "Generated by qdp.py lab pack from surfaced candidate artifacts."
  ]
}