{
  "request_id": "QDPLAB-1F6DB4CFE50DD51B",
  "candidate_id": "m10-case-readout",
  "branch_or_model_tag": "M10_CASE_READOUT",
  "lane": "recovery",
  "scheduler_state": "DRAFTED",
  "exact_falsifier": "If the readout-alias branch is real, readout-power and gain sweeps plus a relinearized fit must remove the anomaly.",
  "priority_experiments": [
    "Readout alias sweep: readout power or gain, digitizer linearity, relinearized fit"
  ],
  "requested_output_artifacts": [
    "EXECUTABLE_FALSIFIER_PACKAGE"
  ],
  "candidate_target_devices": [],
  "instrument_profile_ref": "G:\\GitHub\\incubate\\QDP\\artifacts\\lab\\requests\\m10-case-readout\\QDPLAB-1F6DB4CFE50DD51B_instrument_profile.json",
  "candidate_artifact_manifest_ref": "G:\\GitHub\\incubate\\QDP\\artifacts\\lab\\requests\\m10-case-readout\\QDPLAB-1F6DB4CFE50DD51B_candidate_manifest.json",
  "notes": [
    "Generated by qdp.py lab pack from surfaced candidate artifacts.",
    "Branch-specific sweep axes remain on the candidate via simulation_conditions and tested_parameter_ranges; use the candidate manifest path to recover them."
  ]
}