{
  "request_id": "QDPLAB-48A24B1CAD3FC365",
  "candidate_id": "m09-case-vortex",
  "branch_or_model_tag": "M09_CASE_VORTEX",
  "lane": "recovery",
  "scheduler_state": "DRAFTED",
  "exact_falsifier": "If the vortex branch is real, ZFC vs FC, field-loop history, and matched width or thickness sweeps must preserve the delta fr over delta 1/Qi ordering across cooldowns.",
  "priority_experiments": [
    "Vortex discriminant sweep: ZFC vs FC, field loops, cooldown field, matched width or thickness, delta fr over delta 1/Qi"
  ],
  "requested_output_artifacts": [
    "EXECUTABLE_FALSIFIER_PACKAGE"
  ],
  "candidate_target_devices": [],
  "instrument_profile_ref": "G:\\GitHub\\incubate\\QDP\\artifacts\\lab\\requests\\m09-case-vortex\\QDPLAB-48A24B1CAD3FC365_instrument_profile.json",
  "candidate_artifact_manifest_ref": "G:\\GitHub\\incubate\\QDP\\artifacts\\lab\\requests\\m09-case-vortex\\QDPLAB-48A24B1CAD3FC365_candidate_manifest.json",
  "notes": [
    "Generated by qdp.py lab pack from surfaced candidate artifacts.",
    "Branch-specific sweep axes remain on the candidate via simulation_conditions and tested_parameter_ranges; use the candidate manifest path to recover them."
  ]
}